[
  {
    "schema_version": "propagation_signature_v0_1",
    "signature_id": "prop_sig_temporal_window_0002",
    "cluster_id": 0,
    "window_id": "temporal_window_0002",
    "detected": true,
    "noise": false,
    "services_chain_observed": [
      "redis",
      "payments-api",
      "checkout-api",
      "orders-api"
    ],
    "lag_pattern_seconds_ci": {
      "payments-api_to_redis": {
        "p10": null,
        "p50": null,
        "p90": null
      },
      "redis_to_checkout-api": {
        "p10": 56.0,
        "p50": 56.0,
        "p90": 56.0
      }
    },
    "lag_ci_metadata": {
      "lag_ci_method": "observed_percentiles_p10_p50_p90",
      "sample_window_count": 10,
      "minimum_windows_for_precision": 30,
      "precision": "imprecise"
    },
    "affected_metrics": {
      "payments-api": [
        "latency_p95",
        "iforest_score"
      ],
      "redis": [
        "redis_latency"
      ]
    },
    "metric_ranges_observed": {
      "latency_p95_payments": {
        "min": 176.120004,
        "max": 267.053919
      },
      "latency_p95_orders": {
        "min": 160.874999,
        "max": 258.513891
      },
      "latency_p95_checkout": {
        "min": 170.468566,
        "max": 244.569847
      },
      "error_rate_orders": {
        "min": 0.008869,
        "max": 0.015082
      },
      "error_rate_checkout": {
        "min": 0.009816,
        "max": 0.014108
      },
      "redis_queue_depth": {
        "min": 20.977677,
        "max": 38.052858
      },
      "redis_latency": {
        "min": 7.575154,
        "max": 10.915453
      },
      "iforest_score_payments": {
        "min": 0.453667,
        "max": 0.508658
      }
    },
    "window_data_quality_score": 0.862561,
    "propagation_order_confidence": 1.0,
    "observation_period": {
      "start": "2026-01-01T00:02:07+00:00",
      "end": "2026-01-01T00:04:07+00:00"
    },
    "evidence": {
      "features_used": [
        "iforest_score_max",
        "iforest_score_mean",
        "iforest_score_spread",
        "latency_p95_payments",
        "latency_p95_orders",
        "latency_p95_checkout",
        "delta_latency_orders",
        "delta_latency_checkout",
        "error_rate_payments",
        "error_rate_orders",
        "error_rate_checkout",
        "redis_queue_depth",
        "redis_latency",
        "window_anomaly_density",
        "lag_payments_to_redis",
        "lag_redis_to_checkout",
        "service_degradation_order_encoded"
      ],
      "source_windows": [
        "temporal_window_0002",
        "temporal_window_0003",
        "temporal_window_0004",
        "temporal_window_0005",
        "temporal_window_0046",
        "temporal_window_0047",
        "temporal_window_0058",
        "temporal_window_0059",
        "temporal_window_0060",
        "temporal_window_0061"
      ],
      "backend_executed": "hdbscan",
      "scenario_tag": "S0_NORMAL_BASELINE"
    }
  },
  {
    "schema_version": "propagation_signature_v0_1",
    "signature_id": "prop_sig_temporal_window_0003",
    "cluster_id": 0,
    "window_id": "temporal_window_0003",
    "detected": true,
    "noise": false,
    "services_chain_observed": [
      "checkout-api",
      "orders-api",
      "payments-api",
      "redis"
    ],
    "lag_pattern_seconds_ci": {
      "payments-api_to_redis": {
        "p10": null,
        "p50": null,
        "p90": null
      },
      "redis_to_checkout-api": {
        "p10": 56.0,
        "p50": 56.0,
        "p90": 56.0
      }
    },
    "lag_ci_metadata": {
      "lag_ci_method": "observed_percentiles_p10_p50_p90",
      "sample_window_count": 10,
      "minimum_windows_for_precision": 30,
      "precision": "imprecise"
    },
    "affected_metrics": {
      "payments-api": [
        "latency_p95",
        "iforest_score"
      ],
      "orders-api": [
        "latency_p95"
      ],
      "checkout-api": [
        "latency_p95"
      ]
    },
    "metric_ranges_observed": {
      "latency_p95_payments": {
        "min": 176.120004,
        "max": 267.053919
      },
      "latency_p95_orders": {
        "min": 160.874999,
        "max": 258.513891
      },
      "latency_p95_checkout": {
        "min": 170.468566,
        "max": 244.569847
      },
      "error_rate_orders": {
        "min": 0.008869,
        "max": 0.015082
      },
      "error_rate_checkout": {
        "min": 0.009816,
        "max": 0.014108
      },
      "redis_queue_depth": {
        "min": 20.977677,
        "max": 38.052858
      },
      "redis_latency": {
        "min": 7.575154,
        "max": 10.915453
      },
      "iforest_score_payments": {
        "min": 0.453667,
        "max": 0.508658
      }
    },
    "window_data_quality_score": 0.860951,
    "propagation_order_confidence": 1.0,
    "observation_period": {
      "start": "2026-01-01T00:03:07+00:00",
      "end": "2026-01-01T00:05:07+00:00"
    },
    "evidence": {
      "features_used": [
        "iforest_score_max",
        "iforest_score_mean",
        "iforest_score_spread",
        "latency_p95_payments",
        "latency_p95_orders",
        "latency_p95_checkout",
        "delta_latency_orders",
        "delta_latency_checkout",
        "error_rate_payments",
        "error_rate_orders",
        "error_rate_checkout",
        "redis_queue_depth",
        "redis_latency",
        "window_anomaly_density",
        "lag_payments_to_redis",
        "lag_redis_to_checkout",
        "service_degradation_order_encoded"
      ],
      "source_windows": [
        "temporal_window_0002",
        "temporal_window_0003",
        "temporal_window_0004",
        "temporal_window_0005",
        "temporal_window_0046",
        "temporal_window_0047",
        "temporal_window_0058",
        "temporal_window_0059",
        "temporal_window_0060",
        "temporal_window_0061"
      ],
      "backend_executed": "hdbscan",
      "scenario_tag": "S0_NORMAL_BASELINE"
    }
  },
  {
    "schema_version": "propagation_signature_v0_1",
    "signature_id": "prop_sig_temporal_window_0004",
    "cluster_id": 0,
    "window_id": "temporal_window_0004",
    "detected": true,
    "noise": false,
    "services_chain_observed": [
      "payments-api",
      "redis",
      "checkout-api",
      "orders-api"
    ],
    "lag_pattern_seconds_ci": {
      "payments-api_to_redis": {
        "p10": null,
        "p50": null,
        "p90": null
      },
      "redis_to_checkout-api": {
        "p10": 56.0,
        "p50": 56.0,
        "p90": 56.0
      }
    },
    "lag_ci_metadata": {
      "lag_ci_method": "observed_percentiles_p10_p50_p90",
      "sample_window_count": 10,
      "minimum_windows_for_precision": 30,
      "precision": "imprecise"
    },
    "affected_metrics": {
      "payments-api": [
        "iforest_score"
      ]
    },
    "metric_ranges_observed": {
      "latency_p95_payments": {
        "min": 176.120004,
        "max": 267.053919
      },
      "latency_p95_orders": {
        "min": 160.874999,
        "max": 258.513891
      },
      "latency_p95_checkout": {
        "min": 170.468566,
        "max": 244.569847
      },
      "error_rate_orders": {
        "min": 0.008869,
        "max": 0.015082
      },
      "error_rate_checkout": {
        "min": 0.009816,
        "max": 0.014108
      },
      "redis_queue_depth": {
        "min": 20.977677,
        "max": 38.052858
      },
      "redis_latency": {
        "min": 7.575154,
        "max": 10.915453
      },
      "iforest_score_payments": {
        "min": 0.453667,
        "max": 0.508658
      }
    },
    "window_data_quality_score": 1.0,
    "propagation_order_confidence": 1.0,
    "observation_period": {
      "start": "2026-01-01T00:04:07+00:00",
      "end": "2026-01-01T00:06:07+00:00"
    },
    "evidence": {
      "features_used": [
        "iforest_score_max",
        "iforest_score_mean",
        "iforest_score_spread",
        "latency_p95_payments",
        "latency_p95_orders",
        "latency_p95_checkout",
        "delta_latency_orders",
        "delta_latency_checkout",
        "error_rate_payments",
        "error_rate_orders",
        "error_rate_checkout",
        "redis_queue_depth",
        "redis_latency",
        "window_anomaly_density",
        "lag_payments_to_redis",
        "lag_redis_to_checkout",
        "service_degradation_order_encoded"
      ],
      "source_windows": [
        "temporal_window_0002",
        "temporal_window_0003",
        "temporal_window_0004",
        "temporal_window_0005",
        "temporal_window_0046",
        "temporal_window_0047",
        "temporal_window_0058",
        "temporal_window_0059",
        "temporal_window_0060",
        "temporal_window_0061"
      ],
      "backend_executed": "hdbscan",
      "scenario_tag": "S0_NORMAL_BASELINE"
    }
  },
  {
    "schema_version": "propagation_signature_v0_1",
    "signature_id": "prop_sig_temporal_window_0005",
    "cluster_id": 0,
    "window_id": "temporal_window_0005",
    "detected": true,
    "noise": false,
    "services_chain_observed": [
      "payments-api",
      "redis",
      "checkout-api",
      "orders-api"
    ],
    "lag_pattern_seconds_ci": {
      "payments-api_to_redis": {
        "p10": null,
        "p50": null,
        "p90": null
      },
      "redis_to_checkout-api": {
        "p10": 56.0,
        "p50": 56.0,
        "p90": 56.0
      }
    },
    "lag_ci_metadata": {
      "lag_ci_method": "observed_percentiles_p10_p50_p90",
      "sample_window_count": 10,
      "minimum_windows_for_precision": 30,
      "precision": "imprecise"
    },
    "affected_metrics": {
      "payments-api": [
        "iforest_score"
      ]
    },
    "metric_ranges_observed": {
      "latency_p95_payments": {
        "min": 176.120004,
        "max": 267.053919
      },
      "latency_p95_orders": {
        "min": 160.874999,
        "max": 258.513891
      },
      "latency_p95_checkout": {
        "min": 170.468566,
        "max": 244.569847
      },
      "error_rate_orders": {